<!ELEMENT vertical (#PCDATA)>
<!ATTLIST vertical type (absolute|relative|sequence) "absolute">

<!ELEMENT fireRef (param*)>
<!ATTLIST fireRef label CDATA #REQUIRED>

<!ELEMENT changeDirection (direction, term)>
<!ELEMENT changeSpeed (speed, term)>
<!ELEMENT changeColor (color, term)>
<!ELEMENT changeScale (scale, term)>

<!ELEMENT bulletml (bullet | fire | action)*>
<!ATTLIST bulletml xmlns CDATA #IMPLIED>
<!ATTLIST bulletml type (none | vertical | horizontal) "none">

<!ELEMENT param (#PCDATA)>

<!ELEMENT actionRef (param*)>
<!ATTLIST actionRef label CDATA #REQUIRED>

<!ELEMENT repeat (times, (action | actionRef)+)>

<!ELEMENT accel
  (
    (((horizontal, vertical?) | (horizontal?, vertical)), term) |
    (((vertical, horizontal?) | (vertical?, horizontal)), term) |
    ((horizontal, term, vertical?) | (horizontal?, term, vertical)) |
    ((vertical, term, horizontal?) | (vertical?, term, horizontal)) |
    (term, ((horizontal, vertical?) | (horizontal?, vertical))) |
    (term, ((vertical, horizontal?) | (vertical?, horizontal)))
  )
>
<!ATTLIST accel label CDATA #IMPLIED>

<!ELEMENT times (#PCDATA)>

<!ELEMENT term (#PCDATA)>

<!ELEMENT wait (#PCDATA)>

<!ELEMENT action (accel | changeDirection | changeSpeed | changeColor | changeScale | repeat | wait | (fire | fireRef) | (action | actionRef) | vanish)*>
<!ATTLIST action label CDATA #IMPLIED>

<!ELEMENT vanish (#PCDATA)>

<!ELEMENT speed (#PCDATA)>
<!ATTLIST speed type (absolute|relative|sequence) "absolute">

<!ELEMENT scale (#PCDATA)>
<!ATTLIST scale type (absolute|relative|sequence) "absolute">

<!ELEMENT red (#PCDATA)>
<!ELEMENT green (#PCDATA)>
<!ELEMENT blue (#PCDATA)>
<!ELEMENT alpha (#PCDATA)>
<!ELEMENT opacity (#PCDATA)>
<!ELEMENT color (red?, green?, blue?, alpha?, opacity?)>

<!ELEMENT sprite (#PCDATA)>

<!ELEMENT horizontal (#PCDATA)>
<!ATTLIST horizontal type (absolute|relative|sequence) "absolute">

<!ELEMENT bullet (direction?, speed?, sprite?, color?, scale?, (action | actionRef)*)>
<!ATTLIST bullet label CDATA #IMPLIED>

<!ELEMENT direction (#PCDATA)>
<!ATTLIST direction type (aim|absolute|relative|sequence) "aim">

<!ELEMENT fire
  (
    (direction?, speed?, (bullet | bulletRef)) |
    (speed?, direction?, (bullet | bulletRef)) |
    (direction?, (bullet | bulletRef), speed?) |
    (speed?, (bullet | bulletRef), direction?) |
    ((bullet | bulletRef), direction?, speed?) |
    ((bullet | bulletRef), speed?, direction?) |
    (direction?, speed?, scale?, sprite?, (bullet | bulletRef))
  )
>
<!ATTLIST fire label CDATA #IMPLIED>

<!ELEMENT bulletRef (param*)>
<!ATTLIST bulletRef label CDATA #REQUIRED>