<?xml version="1.0" ?>
<!DOCTYPE bulletml SYSTEM "bulletml.dtd">
<bulletml>
  <action label="top">
    <repeat>
      <times>10000</times>
      <action>
        <repeat>
          <times>10</times>
          <action>
            <fire>
              <bullet>
                <direction type="absolute">$rand * 360</direction>
                <speed type="absolute">0.5</speed>
                <action>
                  <changeSpeed>
                    <speed>0</speed>
                    <term>10000</term>
                  </changeSpeed>
                </action>
              </bullet>
            </fire>
          </action>
        </repeat>
        <wait>1</wait>
      </action>
    </repeat>
  </action>
</bulletml>