<?xml version="1.0" encoding="UTF-8" ?>
<!DOCTYPE bulletml SYSTEM "bulletml.dtd">
<bulletml>
  <action label="top">
    <fire>
      <bullet>
        <speed>5</speed>
        <action>
          <repeat>
            <times>0</times>
            <action>
              <fire>
                <bullet>
                  <direction type="absolute">$rand * 360</direction>
                  <speed>0</speed>
                  <sprite>1</sprite>
                  <actionRef label="explosion">
                    <param>$rand * 7</param>
                  </actionRef>
                </bullet>
              </fire>
              <wait>1</wait>
              <changeDirection>
                <direction type="aim">0</direction>
                <term>1</term>
              </changeDirection>
            </action>
          </repeat>
        </action>
      </bullet>
    </fire>
  </action>

  <action label="explosion">
    <wait>100</wait>
    <changeSpeed>
      <speed>5</speed>
      <term>100</term>
    </changeSpeed>
    <changeColor>
      <color>
        <red>$rand</red>
        <green>$rand</green>
        <blue>$rand</blue>
      </color>
      <term>100</term>
    </changeColor>
    <wait>100</wait>
    <repeat>
      <times>10</times>
      <action>
        <fire>
          <bullet>
            <direction type="sequence">36</direction>
            <speed>5</speed>
            <sprite>$1</sprite>
            <color>
              <red>$rand</red>
              <green>$rand</green>
              <blue>$rand</blue>
            </color>
          </bullet>
        </fire>
      </action>
    </repeat>
  </action>
</bulletml>