<?xml version="1.0" ?>
<!DOCTYPE bulletml SYSTEM "bulletml.dtd">
<bulletml>
  <action label="top">
    <action>
      <fire>
        <bullet>
          <direction type="absolute">0</direction>
          <speed>1</speed>
          <sprite>1</sprite>
        </bullet>
      </fire>
      <wait>30</wait>
      <repeat>
        <times>0</times>
        <action>
          <fire>
            <bullet>
              <direction type="sequence">45</direction>
              <speed>1</speed>
              <sprite>1</sprite>
            </bullet>
          </fire>
          <wait>30</wait>
        </action>
      </repeat>
    </action>

  </action>
</bulletml>